case_id,case_version,case_date,region_code,station_code,crop_group,season_window,initial_salinity_dsm,peak_salinity_dsm,trend_delta_dsm,tide_context,wind_context,trigger_pattern,response_bundle,approval_decision,execution_mode,outcome_class,outcome_summary,replan_recommended,replan_reason,lessons_learned,data_authenticity
CASE-TG-2024-01,2026.1,2024-03-22,TIEN_GIANG,GOCONG-01,rice,dry_peak,2.40,4.10,0.55,rising_to_high_slack,onshore_moderate,warning_persist_then_fast_rise,"notify_farmers|close_gate_simulated|wait_safe_window",approved,simulation,partial_success,"Peak salinity contained after closure advisory; recovery required extended monitoring",false,,"Fast-rise detection prevented delayed escalation","reference_scenario"
CASE-BT-2024-02,2026.1,2024-04-03,BEN_TRE,BINHDAI-02,shrimp,dry_peak,2.90,4.80,0.60,high_to_falling,onshore_strong,critical_with_weather_pressure,"notify_farmers|selective_gate_control|aeration_advisory",approved,simulation,success,"Trend reversed after staged control and communication cadence",false,,"Shrimp systems tolerate higher salinity but need tighter reassessment",reference_scenario
CASE-LA-2024-03,2026.1,2024-03-28,LONG_AN,TANTRU-01,mixed,dry_to_early_rain,2.10,3.70,0.42,rising,variable,warning_to_danger_transition,"advisory_first|wait_safe_window|start_pump_simulated",rejected,simulation,inconclusive,"Approval rejected due to weak evidence confidence and inconsistent station health",true,"Evidence minimum not met","Do not execute when provenance confidence is insufficient",reference_scenario
CASE-VL-2024-04,2026.1,2024-04-11,VINH_LONG,TRAON-01,rice,dry_peak,2.30,3.95,0.37,rising_to_high_slack,onshore_light,repeated_warning_pattern,"notify_farmers|close_gate_simulated|pause_intake",approved,simulation,partial_success,"Warning reduced but persisted near threshold for multiple cycles",true,"Residual risk remained after first execution cycle","Repeated warning patterns should trigger earlier replan",reference_scenario
CASE-SG-2024-05,2026.1,2024-03-16,SOC_TRANG,VINHCHAU-01,orchard,dry_peak,1.70,3.10,0.28,rising,onshore_moderate,early_warning_for_sensitive_crop,"early_advisory|close_gate_simulated|water_source_switch_advisory",approved,simulation,success,"Early conservative actions avoided critical breach for orchard zone",false,,"Perennial crops benefit from lower warning trigger",reference_scenario
CASE-TG-2024-06,2026.1,2024-04-19,TIEN_GIANG,MYTHO-03,rice,dry_to_early_rain,2.60,4.20,0.48,high_slack_to_falling,onshore_strong,critical_then_slow_recovery,"notify_farmers|close_gate_simulated|wait_safe_window",approved,simulation,partial_success,"Critical state exited but safe recovery required three confirmed cycles",false,,"Keep closure posture until consecutive below-warning confirmations",reference_scenario
